{
 "contract": "otsec.register/0.1",
 "family": "sel-751",
 "revision": 1,
 "issued": "2026-10-24",
 "owner": "A2",
 "sources": [
  {
   "id": "S1",
   "title": "SEL-300G Relay Instruction Manual, Quick-Start section (mirror: bcsswitchgear.com `SEL_300G_QuickStart-CD_20060731.pdf`)",
   "date_code": "20060731"
  },
  {
   "id": "S2",
   "title": "SEL-751A Feeder Protection Relay Instruction Manual, PM751A-01-NB (mirror: nepsi.com `SEL-751A-Instructions.pdf`)",
   "date_code": "20130329"
  },
  {
   "id": "S3",
   "title": "SEL-751 Feeder Protection Relay Instruction Manual (official: selinc.com/api/download/10737, unreadable from here; mirror: ManualsLib manual 1617093)"
  },
  {
   "id": "S4",
   "title": "SEL-751 Data Sheet (selinc.com/api/download/10734)"
  },
  {
   "id": "S5",
   "title": "SEL-451-6 Data Sheet (selinc.com/api/download/124252)",
   "date_code": "20260217"
  },
  {
   "id": "S6",
   "title": "SEL-421 Instruction Manual, Table 4.3 Relay Access Levels (ManualsLib 1645670, p. 138)"
  },
  {
   "id": "S7",
   "title": "SEL-2701 Ethernet Processor Instruction Manual, Tables 5.3 and 5.4 (ManualsLib 1584531, p. 72)"
  },
  {
   "id": "S8",
   "title": "SEL-3620 Ethernet Security Gateway product page (selinc.com/products/3620)"
  },
  {
   "id": "S9",
   "title": "SEL white paper LWP0018-01, \"Leveraging Security \u2013 Using the SEL RTAC's Built-In Security Features\" (selinc.com/api/download/112760)",
   "date_code": "20160111"
  },
  {
   "id": "S10",
   "title": "selprotopy 0.1.3 (PyPI sdist, MIT, Joe Stanley): `protocol/commands.py`, `protocol/parser/common.py`, `client/base.py`"
  },
  {
   "id": "S11",
   "title": "go-iec61850 v1.0.2 (pkg.go.dev/github.com/otfabric/go-iec61850)"
  },
  {
   "id": "S12",
   "title": "Triangle MicroWorks, 61850 Test Suite Pro \"Log Services\" page"
  },
  {
   "id": "S13",
   "title": "Digital Substation, \"Magical case study #2: a report-control-block audit in IEDs\""
  },
  {
   "id": "S14",
   "title": "Siemens, \"Cybersecurity for energy automation\" tutorial page"
  },
  {
   "id": "S15",
   "title": "SEL-751A ordering guide WI-7074 (selinc.com/api/download/3278)",
   "date_code": "20180913"
  },
  {
   "id": "S16",
   "title": "SEL-751 Data Sheet, supplied by the owner (`/mnt/project-files/phase0/datasheets-SEL/751_DS_20260910.pdf`)",
   "date_code": "20260910"
  },
  {
   "id": "S17",
   "title": "SEL-311L Data Sheet, supplied by the owner (`311L_DS_20221103.pdf`)",
   "date_code": "20221103"
  },
  {
   "id": "S18",
   "title": "SEL-400G Data Sheet, supplied by the owner (`400G_DS_20260331.pdf`)",
   "date_code": "20260331"
  },
  {
   "id": "S19",
   "title": "SEL-451 Data Sheet, supplied by the owner (`451_DS_20250731.pdf`)",
   "date_code": "20250731"
  },
  {
   "id": "S20",
   "title": "SEL-411L Data Sheet, supplied by the owner (`411L_DS_20250731.pdf`)",
   "date_code": "20250731"
  },
  {
   "id": "S21",
   "title": "SEL-787-2/-3/-4 Data Sheet, supplied by the owner (`787-2-3-4_DS_20250501.pdf`)",
   "date_code": "20250501"
  },
  {
   "id": "S22",
   "title": "SEL-751 Feeder Protection Relay Instruction Manual, supplied by the owner (`OTSEC\\Manuals\\SEL\\751_IM_20260910.pdf`)",
   "date_code": "20260910"
  },
  {
   "id": "S23",
   "title": "ACSELERATOR RTAC SEL-5033 Software Instruction Manual",
   "date_code": "20260925"
  },
  {
   "id": "S24",
   "title": "Programming Reference for ACSELERATOR RTAC SEL-5033 Software",
   "date_code": "20260925"
  },
  {
   "id": "S25",
   "title": "SEL-3355-2 Automation Controller Instruction Manual (PM3355-04)",
   "date_code": "20260521"
  },
  {
   "id": "S26",
   "title": "SEL-2488 Satellite-Synchronized Network Clock Instruction Manual (PM2488-01)",
   "date_code": "20260918"
  },
  {
   "id": "S27",
   "title": "SEL-2731 Ethernet Switch Manual",
   "date_code": "20251223"
  },
  {
   "id": "S28",
   "title": "SEL-2741 Ethernet Switch Manual",
   "date_code": "20260724"
  },
  {
   "id": "S29",
   "title": "Rapid Spanning Tree Protocol for the SEL Managed Ethernet Switch, User's Guide",
   "date_code": "20260424"
  },
  {
   "id": "S30",
   "title": "Software-Defined Networking for the SEL Managed Ethernet Switch, User's Guide",
   "date_code": "20260601"
  },
  {
   "id": "S31",
   "title": "SEL-5056 Network Management System Instruction Manual",
   "date_code": "20261015"
  },
  {
   "id": "S32",
   "title": "SEL-400 Series Relays Instruction Manual (bundled with SEL-451, SEL-411L, SEL-400G manuals)",
   "date_code": "20260730"
  },
  {
   "id": "S33",
   "title": "SEL-311L-0, -6 Instruction Manual",
   "date_code": "20260129"
  },
  {
   "id": "S34",
   "title": "SEL-787-4 Instruction Manual",
   "date_code": "20251212"
  },
  {
   "id": "S35",
   "title": "SEL Application Guide AG95-04, *Compressed ASCII Commands*",
   "date_code": "20030425"
  },
  {
   "id": "S36",
   "title": "SEL-3530 RTAC Instruction Manual (bundled RTAC content)",
   "date_code": "20241217"
  },
  {
   "id": "S37",
   "title": "SEL-3555-2 RTAC Instruction Manual",
   "date_code": "20250730"
  },
  {
   "id": "S38",
   "title": "SEL-3505/3505-3 RTAC Instruction Manual",
   "date_code": "20241217"
  },
  {
   "id": "S39",
   "title": "SEL-3350-1 Automation Controller Instruction Manual",
   "date_code": "20260928"
  },
  {
   "id": "S40",
   "title": "SEL-3610 Port Server, SEL-3620 Ethernet Security Gateway, SEL-3622 Security Gateway Instruction Manual",
   "date_code": "20241010"
  },
  {
   "id": "S41",
   "title": "SEL-735 Power Quality and Revenue Meter Instruction Manual",
   "date_code": "20250711"
  },
  {
   "id": "S42",
   "title": "SEL-2401, SEL-2404, SEL-2407 Satellite-Synchronized Clock Instruction Manuals",
   "date_code": "20250918"
  },
  {
   "id": "S43",
   "title": "SEL-2730M Managed Ethernet Switch Instruction Manual (PM2730M-01), supplied 2026-10-23 at about 18:56",
   "date_code": "20260408"
  },
  {
   "id": "A2-P0",
   "title": "A2 Phase 0 register draft, docs/phase0/A2-command-register-draft.json (a ruling, not a document)"
  }
 ],
 "preconditions": [
  {
   "id": "pre.lang_english",
   "setting": "LANG",
   "equals": "ENGLISH",
   "read_by": "sel.settings.show_port1",
   "reason": "ADR-0005 (A1 401ebd7, from A6 F-006): command names differ on a Spanish port and 'SER D' clears the SER; refuse to collect unless SHO P 1 parses as English port settings with LANG := ENGLISH."
  }
 ],
 "operations": [
  {
   "id": "sel.id",
   "citations": [
    {
     "source": "S22",
     "ref": "Table 7.43 and Figure 7.38 p.7.64"
    },
    {
     "source": "S22",
     "ref": "Figure 3.20 p.3.14"
    }
   ],
   "evidence": {
    "class": "documented-untested"
   },
   "side_effects": "None documented. Occupies the session for the response.",
   "notes": "Fields FID, BFID, CID, DEVID, DEVCODE, PARTNO, CONFIG, SPECIAL, display package lines, and on IEC 61850 models iedName/type/configVersion. Per-line checksum = 4-hex sum of characters of '\"KEY=value\",' (verified on all 10 lines of Figure 7.38).",
   "classification": "read-only",
   "line": "ID",
   "access_level": "0"
  },
  {
   "id": "sel.ser.read_all",
   "citations": [
    {
     "source": "S22",
     "ref": "Table 7.63 p.7.75 ('Displays a chronological progression of all available SER rows (as many as 1024 rows). Row 1 is the most recently triggered row')"
    },
    {
     "source": "S22",
     "ref": "Figure 10.16 p.10.40"
    }
   ],
   "evidence": {
    "class": "documented-untested"
   },
   "side_effects": "None documented. Returns up to the full ring buffer (1,024 rows on SEL-751, S4), so every read repeats rows already collected.",
   "notes": "On SEL-751 bare SER returns all rows (unlike A4's report for SEL-400 series). Row/date range forms exist (Table 7.63) but stay denied until needed.",
   "classification": "read-only",
   "line": "SER",
   "access_level": "1"
  },
  {
   "id": "sel.settings.show_global",
   "citations": [
    {
     "source": "S22",
     "ref": "Table 7.67 p.7.77 ('SHO G s Shows global settings', Access Level 1)"
    },
    {
     "source": "S22",
     "ref": "Table 4.90 p.4.230 (UTC_OFF, DST_BEGM..DST_ENDH, DATE_F)"
    }
   ],
   "evidence": {
    "class": "documented-untested"
   },
   "side_effects": "None documented. Output contains configuration values; store as sensitive evidence.",
   "notes": "APPROVED by A1 2026-10-23 as this exact line, with no setting-name argument s. Needed to state UTC offset and DST rule for SER local times. Output is sensitive configuration evidence. No password-bearing setting appears in any S22 settings sheet (A2 searched every ':=' line for pass/pwd/key/secret/community/auth: none); passwords are set only with PAS (Table 7.52) and are not settings. S22 prints no example SHO G output.",
   "classification": "read-only",
   "line": "SHO G",
   "access_level": "1"
  },
  {
   "id": "sel.settings.show_port1",
   "citations": [
    {
     "source": "S22",
     "ref": "Table 7.67 p.7.77 ('SHO P n s Shows serial port settings. n specifies the port', Access Level 1)"
    },
    {
     "source": "S22",
     "ref": "Port 1 is Ethernet per S22 Table 7.1 p.7.1"
    },
    {
     "source": "S22",
     "ref": "Port 1 settings sheet (ETELNET, MAXACC, LANG, TPORT, TCBAN, TIDLE, FASTOP, EFTPSERV, FTPACC, FTPUSER, HTTPACC)"
    }
   ],
   "evidence": {
    "class": "documented-untested"
   },
   "side_effects": "None documented. Output contains addresses and FTPUSER; store as sensitive evidence.",